{
  "$schema": "https://json-schema.org/draft/2020-12/schema",
  "$id": "https://example.invalid/rpg-engine/scene-bindings.schema.json",
  "title": "RPG Engine Scene Bindings",
  "type": "object",
  "required": ["version", "entities", "areas", "events"],
  "properties": {
    "version": { "type": "integer", "minimum": 1 },
    "entities": {
      "type": "object",
      "additionalProperties": {
        "type": "object",
        "properties": {
          "2d_scene": { "type": "string" },
          "3d_scene": { "type": "string" }
        },
        "additionalProperties": false
      }
    },
    "areas": {
      "type": "object",
      "additionalProperties": {
        "type": "object",
        "properties": {
          "2d_scene": { "type": "string" },
          "3d_scene": { "type": "string" }
        },
        "additionalProperties": false
      }
    },
    "events": { "type": "object", "additionalProperties": { "type": "string" } }
  },
  "additionalProperties": false
}
